,type,difficulty,category,question,correct_answer,incorrect_answers
0,multiple,medium,General Knowledge,What are the three starter Pokemon available in Pokemon Black and White?,"Snivy, Tepig, Oshawott","['Snivy, Fennekin, Froakie', 'Chespin, Tepig, Froakie', 'Chespin, Fennekin, Oshawott']"
1,multiple,medium,General Knowledge,What is the name of the very first video uploaded to YouTube?,Me at the zoo,"['tribute', 'carrie rides a truck', 'Her new puppy from great grandpa vern.']"
2,multiple,medium,General Knowledge,The architect known as Le Corbusier was an important figure in what style of architecture?,Modernism,"['Neoclassical', 'Baroque', 'Gothic Revival']"
3,multiple,medium,General Knowledge,What is the Italian word for &quot;tomato&quot;?,Pomodoro,"['Aglio', 'Cipolla', 'Peperoncino']"
4,multiple,medium,General Knowledge,What is the currency of Poland?,Złoty,"['Ruble', 'Euro', 'Krone']"
5,multiple,medium,General Knowledge,"The Fields Medal, one of the most sought after awards in mathematics, is awarded every how many years?",4,"['3', '5', '6']"
6,multiple,medium,General Knowledge,"What is the name of the popular animatronic singing fish prop, singing such hits such as &quot;Don&#039;t Worry, Be Happy&quot;?",Big Mouth Billy Bass,"['Big Billy Bass', 'Singing Fish', 'Sardeen']"
7,multiple,medium,General Knowledge,"Linus Pauling, one of the only winners of multiple Nobel Prizes, earned his Nobel Prizes in Chemistry and what?",Peace,"['Physics', 'Economics', 'Physiology/Medicine']"
8,multiple,medium,General Knowledge,What was the original name of the search engine &quot;Google&quot;?,BackRub,"['CatMassage', 'SearchPro', 'Netscape Navigator']"
9,multiple,medium,General Knowledge,Frank Lloyd Wright was the architect behind what famous building?,The Guggenheim,"['Villa Savoye', 'Sydney Opera House', 'The Space Needle']"
10,multiple,medium,General Knowledge,Which iconic Disneyland attraction was closed in 2017 to be remodeled as a &quot;Guardians of the Galaxy&quot; themed ride?,Twilight Zone Tower of Terror,"['The Haunted Mansion', 'Pirates of the Caribbean', 'Peter Pan&#039;s Flight']"
11,multiple,medium,General Knowledge,Where did the pineapple plant originate?,South America,"['Hawaii', 'Europe', 'Asia']"
12,multiple,medium,General Knowledge,Which item of clothing is usually worn by a Scotsman at a wedding?,Kilt,"['Skirt', 'Dress', 'Rhobes']"
13,multiple,medium,General Knowledge,What is the last letter of the Greek alphabet?,Omega,"['Mu', 'Epsilon', 'Kappa']"
14,multiple,medium,General Knowledge,What is the defining characteristic of someone who is described as hirsute?,Hairy,"['Rude', 'Funny', 'Tall']"
15,multiple,medium,General Knowledge,"In a 1994 CBS interview, Microsoft co-founder Bill Gates performed what unusual trick on camera?",Jumping over an office chair,"['Jumping backwards over a desk', 'Standing on his head', 'Typing on a keyboard during a handstand']"
16,multiple,medium,General Knowledge,Who is the founder of &quot;The Lego Group&quot;?,Ole Kirk Christiansen,"[' Jens Niels Christiansen', 'Kirstine Christiansen', ' Gerhardt Kirk Christiansen']"
17,multiple,medium,General Knowledge,"According to the United States&#039; CDC, one in how many Americans die annually due to smoking?",Five,"['Twenty', 'Ten', 'One hundred']"
18,multiple,medium,General Knowledge,What year was Apple Inc. founded?,1976,"['1978', '1980', '1974']"
19,multiple,medium,General Knowledge,What is a Burgee?,A flag,"['A rope', 'A window', 'A type of food']"
20,multiple,medium,General Knowledge,The Mexican Beer &quot;Corona&quot; is what type of beer?,Pale Lager,"['India Pale Ale', 'Pilfsner', 'Baltic Porter']"
21,multiple,medium,General Knowledge,"In ancient Greece, if your job were a &quot;hippeus&quot; which of these would you own?",Horse,"['Weave', 'Guitar', 'Boat']"
22,multiple,medium,General Knowledge,What is the Swedish word for &quot;window&quot;?,F&ouml;nster,"['H&aring;l', 'Sk&auml;rm', 'Ruta']"
23,multiple,medium,General Knowledge,Which country drives on the left side of the road?,Japan,"['Germany', 'Russia', 'China']"
24,multiple,medium,General Knowledge,Who is a co-founder of music streaming service Spotify?,Daniel Ek,"['Sean Parker', 'Felix Miller', 'Michael Breidenbruecker']"
25,multiple,medium,General Knowledge,"Which slogan did the fast food company, McDonald&#039;s, use before their &quot;I&#039;m Lovin&#039; It&quot; slogan?",We Love to See You Smile,"['Why Pay More!?', 'Have It Your Way', 'Making People Happy Through Food']"
26,multiple,medium,General Knowledge,Which language is NOT Indo-European?,Hungarian,"['Russian', 'Greek', 'Latvian']"
27,multiple,medium,General Knowledge,What was the destination of the missing flight MH370?,Beijing,"['Kuala Lumpur', 'Singapore', 'Tokyo']"
28,multiple,medium,General Knowledge,Rolex is a company that specializes in what type of product?,Watches,"['Cars', 'Computers', 'Sports equipment']"
29,multiple,medium,General Knowledge,"On average, Americans consume 100 pounds of what per second?",Chocolate,"['Potatoes', 'Donuts', 'Cocaine']"
30,multiple,medium,General Knowledge,Which American manufactured submachine gun was informally known by the American soldiers that used it as &quot;Grease Gun&quot;?,M3,"['Colt 9mm', 'Thompson', 'MAC-10']"
31,multiple,medium,General Knowledge,What fast food chain has the most locations globally? ,Subway,"['Starbucks', 'McDonalds', 'KFC']"
32,multiple,medium,General Knowledge,What is the German word for &quot;spoon&quot;?,L&ouml;ffel,"['Gabel', 'Messer', 'Essst&auml;bchen']"
33,multiple,medium,General Knowledge,Which of the following Ivy League universities has its official motto in Hebrew as well as in Latin?,Yale University,"['Princeton University', 'Harvard University', 'Columbia University']"
34,multiple,medium,General Knowledge,Which of the following carbonated soft drinks were introduced first?,Dr. Pepper,"['Coca-Cola', 'Sprite', 'Mountain Dew']"
35,multiple,medium,General Knowledge,Whose greyscale face is on the kappa emoticon on Twitch?,Josh DeSeno,"['Justin DeSeno', 'John DeSeno', 'Jimmy DeSeno']"
36,multiple,medium,General Knowledge,"According to the BBPA, what is the most common pub name in the UK?",Red Lion,"['Royal Oak', 'White Hart', 'King&#039;s Head']"
37,multiple,medium,General Knowledge,"What did the Spanish autonomous community of Catalonia ban in 2010, that took effect in 2012?",Bullfighting,"['Fiestas', 'Flamenco', 'Mariachi']"
38,multiple,medium,General Knowledge,What is a dead mall?,A mall with high vacancy rates or low consumer foot traffic,"['A mall with no stores', 'A mall that has been condemed', 'A mall after business hours']"
39,multiple,medium,General Knowledge,Earl Grey tea is black tea flavoured with what?,Bergamot oil,"['Lavender', 'Vanilla', 'Honey']"
40,multiple,medium,General Knowledge,What is real haggis made of?,"Sheep&#039;s Heart, Liver and Lungs","['Sheep&#039;s Heart, Kidneys and Lungs', 'Sheep&#039;s Liver, Kidneys and Eyes', 'Whole Sheep']"
41,multiple,medium,General Knowledge,"What country saw a world record 315 million voters turn out for elections on May 20, 1991?",India,"['United States of America', 'Soviet Union', 'Poland']"
42,multiple,medium,General Knowledge,In 2013 how much money was lost by Nigerian scams?,$12.7 Billion,"['$95 Million', '$956 Million', '$2.7 Billion']"
43,multiple,medium,General Knowledge,What direction does the Statue of Liberty face?,Southeast,"['Southwest', 'Northwest', 'Northeast']"
44,multiple,medium,General Knowledge,The website &quot;Shut Up &amp; Sit Down&quot; reviews which form of media?,Board Games,"['Television Shows', 'Video Games', 'Films']"
45,multiple,medium,General Knowledge,Who invented Pastafarianism?,Bobby Henderson,"['Eric Tignor', 'Bill Nye', 'Zach Soldi']"
46,multiple,medium,General Knowledge,What is the name given to Indian food cooked over charcoal in a clay oven?,Tandoori,"['Biryani', 'Pani puri', 'Tiki masala']"
47,multiple,medium,General Knowledge,"In the Morse code, which letter is indicated by 3 dots? ",S,"['O', 'A', 'C']"
48,multiple,medium,General Knowledge,What is the star sign of someone born on Valentines day?,Aquarius,"['Pisces', 'Capricorn', 'Scorpio']"
49,multiple,medium,General Knowledge,Apple co-founder Steve Jobs died from complications of which form of cancer?,Pancreatic,"['Bone', 'Liver', 'Stomach']"
